business_id,review_id,user_id,stars,useful,funny,cool,text,date,topic
XQfwVwDr-v0ZS3_CbbE5Xw,fvu5n5shkAJDbQjulKNuqw,NMLvjdY7IOdtfU0TepvUuA,2,8,0,0,"I really wanted to love this restaurant.  The interior is really well decorated and the food looked awesome.  My wife and I stopped in for breakfast on a Sunday in May.  There was a 15 minute wait but there were (2) seats at the counter so we grabbed them.

Our waitress came right over and introduced herself along with the other girl working the counter area.  We perused the menu and placed our orders.  My french press coffee came out quickly but that was the only thing that was quick.  After 30+ minutes our meals came out and during that time neither of the girls behind the counter checked on our drinks or gave us an update on our food.  After speaking with several other people it seems the long wait times are the norm.  Hopefully they will work the kinks out since they are fairly new.

I had the Big Easy Benedict - Cornbread topped with avocado, creole seasoned onions, peppers and chorizo. Topped with poached eggs and cajun hollandaise.  The corn bread was awesome and I would give the entire meal a solid B.

My wife had the Fruity Chicken Salad - Two scoops of homemade chicken salad accompanied by California raisins, fresh seasonal fruit on a layer of baby spinach leaves with an english muffin.  The Chieck Salad was good but she thought the portion was small.

If I was just reviewing the food I would give it 3 1/2 stars but the wait and service was so poor I had to bring the overall rating to 2.  I will return and see if the service improves.",2017-05-30 13:24:32,"counter, came, wait, food, salad"
XQfwVwDr-v0ZS3_CbbE5Xw,0O94-lsE4GLu6OKxNJMqng,hWk9llQXOkGevREpVWUoRA,5,0,1,0,Love the Kona French press here! Takes me back to Hawaii! Had the Big Easy Benedict and it was delicious! My wife had the Wilbur skillet and another great dish. The server couldn't have been more attentive and friendly. Cant wait to get back!,2017-05-21 17:28:52,"back, wait, easy, french, press"
XQfwVwDr-v0ZS3_CbbE5Xw,DjNpXU9rLjt5Lj6509zwRg,GDFxuMYlwN32x-BAnmxumg,1,0,1,0,"While the food is good, the service is terrible and the staff is rude. I recommend choosing somewhere else",2017-12-09 18:47:55,"recommend, choosing, somewhere, rude, staff"
XQfwVwDr-v0ZS3_CbbE5Xw,avH6BWW3ZiUzsBwP1c8JbQ,l8h1dnLEprUO7Ixdc1F3RQ,1,1,0,0,Went to the turning point with our friends today for the first time and it will be our last. We were seated promotly and waited over 50 minutes for breakfast items we ordered. 50 minutes for breakfast and being told the kitchen is really backed up. I could have had our 4 items we ordered done in 10 minutes especially in a commercial kitchen and I am far from a chef. I ordered the basic skillet. Potatoes were over salted and this dish comes with eggs that were over cooked after asking for over easy created an extremely dry dish. Manager comped our meal but was not very friendly. Felt very sorry for our waiter. He was stuck in the middle.  Other breakfast items were only okay and really nothing to rave about. If this place survives I will be amazed unless they change their kitchen crew. Breakfast really is not that difficult or that hard to make. If you fail miserably at making breakfast you probably will not do well at asking anything more difficult.,2017-05-21 19:45:17,"breakfast, items, minutes, really, ordered"
XQfwVwDr-v0ZS3_CbbE5Xw,VcYCE4VAeFcximi0-WuK7A,pdyRfwcLV3fAGXCYLXDRYw,1,5,0,0,"Today I went in expecting a nice family brunch. After waiting we were finally seated and ordered our meal, only to end up sitting for over 50 mins with no food. I went up to talk to the manager, to try and explain how the other table seated much later were able to get their food before us. My husband left church early just to spend time together and had to return back, so we were trying to accommodate. But instead of apologizing and showing signs of concern, the manager's first comment was ""I can pack in to-go box"". We sat for 1 full hour! Really?

So when the food came out, we returned the Reuben sandwich, since my husband was now gone, and upset. 

When we asked for the bill, I got a check for all three orders which was taken care by ""Manger Comp"". 

I understand mistakes can happen. But the way the manager dealt with our situation, was very unkind. He should have been more polite and accommodated us more professionally. It was my first time, and I will probably not go back to this place again, unless they have a more established system working around it. 

We went in there with happy mood, sat there waiting for our food for an hour miserably, only to decide to simply eat and go. The ""comp"" check that was brought to us by the server, and not by the manager himself made it that much more upsetting.  This made myself and my daughter feel upset and we left with a sour feeling about the whole place. 

I plan to take this up to the corporate manager about how we were served by the server and about how things were handled by the manager!  Terrible first time experience here!!!",2017-05-21 19:10:32,"manager, food, first, went, time"
XQfwVwDr-v0ZS3_CbbE5Xw,iEh6HVabisUoJASFEvSYEg,-wHb3saowEIu9s6Cz6zYLw,1,1,0,0,"Horrible experience. First, it was crowded on Father's Day, which we expected. Once we were seated, I notice that the table was wobbling and it spins.  I informed the waitress about the table.  She couldn't do anything about it.  When we got our coffee, I realized that she forgot to give us spoons for the coffee. Finally, our food came. Again, I realized that she forgot to give us our utensils to eat the food.  I had to walk to the front and inform the hostesses that we had no utensils.  Everyone got their food except me.  The chicken with waffles took forever the make.  I will never go here again.",2018-06-17 17:29:01,"food, us, realized, give, coffee"
XQfwVwDr-v0ZS3_CbbE5Xw,e0wev6krqh76B80GGQ7nMg,V-UaXOXv7xkRgOOIozhHsQ,1,0,0,0,"Terrible service. Waiting staff is very disorganized, cannot take down the clients name correctly. It's a luxury to get greetings out of them, food is mediocre at best.
Last time we were here waiter delivered wrong order to our table, spilled fruits all over when setting down the plate. Then he quickly picked up the plate and delivered to the right table, I doubt that guest had any clue.",2018-03-22 16:37:39,"delivered, plate, table, waiter, staff"
XQfwVwDr-v0ZS3_CbbE5Xw,AuTScCoitEKwIaAEp_R3ew,NfJWn26QV68E48wtrx8OCQ,1,1,0,0,"I was exited to meet with my bosom friends for brunch at this new joint. Maybe we were more focusing on each other than actual foods. The atmosphere was lively. The food came out rather too  fast and then the waiters and waitress started  coming every 5 minutes to ask if we finished eating or needed anything else etc. We felt like our conversation were constantly interrupted and wound up not finishing foods and left the place to talk at elsewhere. Waisted $50 for waffles, egg Benedict and brunch size salad and coffee in less than an hour. We will never go back.",2017-07-26 04:08:23,"brunch, foods, size, less, eating"
XQfwVwDr-v0ZS3_CbbE5Xw,OTODlR88KHVb5wNyRdulGw,g2msNh9EGVSnTdYG8pfEDg,2,0,0,0,Took some colleagues here for lunch based on a recommendation. We chose mostly breakfasts. The meals were lackluster. The service was terrible. Although the waitress was friendly our meals arrived in two parts. My friends meal arrived minutes later and we watched them take it outside to a table and then back into the restaurant and delivered to him. Our meal portions were small and overcooked. Waited forever for the check. The worst part was the acoustics as it was incredibly loud in the room. I might give this another chance but will wait for them to get their act together if they can.,2017-05-19 11:26:40,"arrived, meals, meal, overcooked, delivered"
XQfwVwDr-v0ZS3_CbbE5Xw,KAXtFKuSw_yPgHhKO_Je3A,6QP95ARs4kbOps-Ca034wg,4,0,0,0,"This was kind of brunch place i have been looking for. This was 2nd time going back , food was pretty good! Will def go back",2017-11-01 05:03:49,"back, place, looking, good, food"
XQfwVwDr-v0ZS3_CbbE5Xw,WMKe201GP7G3iL_xlHxxHg,vDzDD3gjPdIv4_Xp97KzQA,2,0,0,0,"A whole lotta nothing. Great space, Phenomenal menu. Problem was the food didn't have any flavor. I had an omelette where the Asparagus was undercooked and it had no taste. The grain pancakes were good, not special. My wife had a frittata that was Disguised as an omelette. Once again lacking flavor.  The servers screwed up our order and didn't really take ownership.  I'll give them credit in that they were flexible in modifying dishes.  Would not go back",2018-11-25 17:10:13,"omelette, flavor, give, pancakes, whole"
XQfwVwDr-v0ZS3_CbbE5Xw,KdcENhUtYYo6bg_bf940Tg,CLXT2JlD8sXCEU3oG_hxNw,1,0,0,0,"Had been impressed with this place when it first opened. Good food selection, different then other places. But had to walk out this morning because the counter was not cleaned for a good 15 minutes while we sat. We watched others leave as well. Didn't appear to be that crawded so not sure why the poor service. Hopefully they can clean up their act.",2018-09-22 15:45:00,"good, morning, service, places, clean"
XQfwVwDr-v0ZS3_CbbE5Xw,h78e76_7JSSBvZ7L7oasqQ,5itRTlCho6A9JRXjFhPPxQ,4,0,0,0,"The service was a little slow but the food was good. I had the protein bowl and it was a good size for the price. The cold brew coffee was decent, nothing special aside from the presentation. The bathroom was clean. I would eat here again.",2018-09-01 20:32:25,"good, food, special, price, presentation"
XQfwVwDr-v0ZS3_CbbE5Xw,WglA0BSYvc3WBP4I2WpRwA,1_sws6Q8TiR21CzzNvxUiw,5,0,0,0,"I've been here now twice for brunch and the food is amazing. I've seen other yelpers mention that the service is terrible, but I didn't experience that today. I ordered the chicken and waffles dish and so did my aunt that I was with. She cannot eat pork and we didn't realize there were bacon bits on top of the dish. Our server immediately got the manager and a new dish was made right away. I can't wait to come back for the french press coffee and more chicken and waffles!",2019-04-15 01:20:23,"dish, chicken, waffles, top, coffee"
XQfwVwDr-v0ZS3_CbbE5Xw,3KIFs2G29KtGhgMQnI5iPw,UkJJf2dc_9UDqP7CSkGK_g,1,0,0,0,Took forever just to get our coffee. We received one of our breakfasts fairly quickly but my fiancé never got his breakfast so we had to split my omelet. Not worth the money or the service.,2018-03-21 15:45:11,"never, took, get, worth, coffee"
